{
  "$schema": "./state.schema.json",
  "feature": {
    "number": "011",
    "slug": "implement-authentication-and-authorization",
    "title": "Implement Authentication and Authorization",
    "directory": ".features/011.implement-authentication-and-authorization"
  },
  "state": "plan",
  "created_at": "2026-06-08T14:02:11-07:00",
  "updated_at": "2026-06-10T18:35:42-07:00",
  "history": [
    {
      "from": "initial",
      "to": "spec",
      "at": "2026-06-08T14:09:30-07:00",
      "by": "wiggins",
      "note": "First non-blank draft of spec.md committed; agents began discussion."
    },
    {
      "from": "spec",
      "to": "plan",
      "at": "2026-06-10T11:47:05-07:00",
      "by": "kyle",
      "note": "All three spec agents satisfied; complexity estimated at 13 points."
    }
  ],
  "stages": {
    "spec": {
      "status": "complete",
      "sub_state": null,
      "started_at": "2026-06-08T14:09:30-07:00",
      "completed_at": "2026-06-10T11:47:05-07:00",
      "current_agent": null,
      "agents": {
        "wiggins": {
          "name": "Wiggins",
          "role": "Product Manager",
          "personality": "Very experienced software designer and architect with over 20 years building web, mobile, and gaming applications; former game producer. Cares deeply about the user and about consistency — his mantra is that every feature should be self-documenting and obvious. Personal hero: Steve Jobs, because Apple products are so easy to use. Calm, decisive, allergic to feature creep.",
          "responsibilities": [
            "Write the first draft of spec.md from the loosely defined idea in overview.md",
            "Resolve every disagreement between agents — his call is final",
            "Keep the spec scoped to login, registration, session management, and role-based authorization",
            "Declare satisfaction with the exact satisfaction phrase when the spec is complete"
          ],
          "expertise": ["product strategy", "game design", "interaction design", "feature scoping"],
          "authority": "final_arbiter",
          "satisfied": true,
          "sign_off_at": "2026-06-10T11:40:18-07:00",
          "criticisms": 0,
          "revisions": 4
        },
        "cartman": {
          "name": "Cartman",
          "role": "UX Designer",
          "personality": "Loud, supremely self-assured, and utterly convinced his taste is authoritah — but channels every ounce of it into ruthless advocacy for the user. Obsessive about whether users can understand a feature just by looking at the screens; if a flow needs explaining, it's broken and he will say so theatrically. Fluent in established design patterns and applies them directly to the spec rather than just commenting.",
          "responsibilities": [
            "Flag any issues with the UX of the proposed auth flows",
            "Directly update the spec with known design patterns (e.g. modal conventions matching ChooseGameTypeModal)",
            "Verify users understand login, registration, and error states purely from the screens",
            "Iterate with the Product Manager until both utter the satisfaction phrase"
          ],
          "expertise": ["interaction design", "design patterns", "accessibility", "onboarding flows"],
          "authority": "contributor",
          "satisfied": true,
          "sign_off_at": "2026-06-10T11:42:51-07:00",
          "criticisms": 5,
          "revisions": 2
        },
        "kyle": {
          "name": "Kyle",
          "role": "Senior Frontend Engineer",
          "personality": "Morally serious, security-first engineer who assumes every input is hostile and argues his case hard — especially against Cartman. Hunts for security holes and 'impossibilities' in designs before a line of code is written. Insists on the latest, most modern methods — JWT for tokens, argon2id for passwords, strict CORS allow-lists. Pragmatic about cost: researches the cheapest way to integrate any third-party tooling before approving it.",
          "responsibilities": [
            "Identify security holes in the design: CORS, secret encryption, password hashing, token storage",
            "Flag any 'impossibilities' or unusually complicated pieces, including third-party tooling such as Redis",
            "Research the least expensive integration path for any required tooling",
            "Append security and feasibility discoveries directly to spec.md",
            "Sign off with an additive complexity estimate: 1 pt ≈ 2 h, 2 pt ≈ 2/3 day, 3 pt ≈ 1 day (15 pt ≈ one engineer-week)"
          ],
          "expertise": ["web security", "JWT", "CORS", "password hashing", "React", "cost-aware integration"],
          "authority": "sign_off",
          "satisfied": true,
          "sign_off_at": "2026-06-10T11:47:05-07:00",
          "criticisms": 3,
          "revisions": 1
        }
      },
      "protocol": {
        "entry_agent": "wiggins",
        "interaction": [
          "Wiggins writes the first draft of spec.md.",
          "Cartman flags issues or directly updates the spec with known design patterns.",
          "Wiggins and Cartman go back and forth until each utters the satisfaction phrase.",
          "Only then is Kyle brought in: he reviews complexity, third-party tooling, cost, and security, appending discoveries to spec.md.",
          "If Kyle flags blocking issues, the loop returns to Wiggins; otherwise he signs off with complexity points."
        ],
        "satisfaction_phrase": "I am satisfied with this specification, let's bring in the Frontend Engineer",
        "max_rounds": 10,
        "exit_criteria": {
          "all_agents_satisfied": true,
          "artifacts_written": ["spec.md"],
          "required_sign_offs": ["kyle"],
          "set_sub_state": null,
          "advance_global_state_to": "plan"
        }
      },
      "counters": {
        "criticisms": 8,
        "revisions": 7,
        "handovers": 6,
        "discussion_rounds": 4
      },
      "handovers": [
        {
          "from": "wiggins",
          "to": "cartman",
          "at": "2026-06-08T16:20:00-07:00",
          "note": "First draft ready for UX review."
        },
        {
          "from": "cartman",
          "to": "wiggins",
          "at": "2026-06-09T09:05:00-07:00",
          "note": "Login/registration modal flow unclear; magic-link fallback proposed."
        },
        {
          "from": "wiggins",
          "to": "cartman",
          "at": "2026-06-09T13:30:00-07:00",
          "note": "Draft 2: single ChooseAuthMethod modal, consistent with ChooseGameTypeModal."
        },
        {
          "from": "cartman",
          "to": "wiggins",
          "at": "2026-06-09T17:55:00-07:00",
          "note": "I am satisfied with this specification, let's bring in the Frontend Engineer."
        },
        {
          "from": "wiggins",
          "to": "kyle",
          "at": "2026-06-10T08:15:00-07:00",
          "note": "Spec frozen pending engineering review."
        },
        {
          "from": "kyle",
          "to": "wiggins",
          "at": "2026-06-10T11:47:05-07:00",
          "note": "Appended security section: JWT (HS256, rotating secret), httpOnly SameSite=Lax cookies, CORS allow-list, argon2id password hashing. No third-party infra needed. 13 points."
        }
      ],
      "artifacts": ["overview.md", "spec.md"],
      "complexity_points": 13
    },
    "plan": {
      "status": "in_progress",
      "sub_state": "planning_in_progress",
      "started_at": "2026-06-10T13:00:00-07:00",
      "completed_at": null,
      "current_agent": "jeff-dean",
      "agents": {
        "wiggins": {
          "name": "Wiggins",
          "role": "Product Manager",
          "personality": "Same agent who shepherded the spec stage — carries full context of every decision made there. Answers any questions and clarifies ambiguities for the engineers; does not write code or schema himself.",
          "responsibilities": [
            "Answer questions and clarify any ambiguity in spec.md for the engineering agents",
            "Resolve disagreements between the two engineers — his call is final",
            "Confirm the plan still delivers the user experience agreed in the spec"
          ],
          "expertise": ["product strategy", "feature scoping", "the agreed spec"],
          "authority": "final_arbiter",
          "satisfied": false,
          "sign_off_at": null,
          "criticisms": 1,
          "revisions": 0
        },
        "jeff-dean": {
          "name": "Jeff Dean",
          "role": "Senior Superstar Engineer",
          "personality": "Extremely senior across both frontend and backend; has published multiple papers. Thinks in orders of magnitude — every design must survive scaling to millions of users while keeping costs low. Insists relational databases use UUID primary keys, foreign keys, and check constraints. Knows PostgreSQL 18 inside out and proposes advanced features (uuidv7(), virtual generated columns, skip-scan indexes) the younger engineer might not know about.",
          "responsibilities": [
            "Catch issues related to scaling to millions of users",
            "Keep infrastructure and operating cost low",
            "Ensure UUID primary keys plus FK and check constraints on every table",
            "Propose advanced PostgreSQL 18 features where they simplify or speed up the design",
            "Specify Honeycomb telemetry spans and structured logging for every auth path"
          ],
          "expertise": ["distributed systems", "PostgreSQL 18", "cost optimization", "telemetry", "backend and frontend at scale"],
          "authority": "contributor",
          "satisfied": false,
          "sign_off_at": null,
          "criticisms": 2,
          "revisions": 1
        },
        "kiggie": {
          "name": "Kiggie",
          "role": "Frontend Super-smart Engineer",